nombre|ubicacion|ubicacion_detalle|ubicacion_referencia|distrito|region|fecha_inicio|fecha_inicio_alt|fecha_fin|descripcion|precio|organizador|asistiran|me_interesa|veces_compartido|imagen|enlace_evento¡Deyvis Orosco en Mall Aventura Santa Anita!|Mall Aventura|||||2019-12-08 17:37:34.749003 - 19:00 ||2019-12-08 17:37:34.749003 - 20:00 |"¡Deyvis Orosco en ,! , , Te esperamos este domingo 08 de diciembre desde las 7pm para cantar y bailar juntos las mejores canciones del ""Bomboncito de la cumbia"". , Lugar: 1er nivel (frente a la Villa Navideña)., ¡Esta Navidad ,! , INGRESO LIBRE."||Mall Aventura|665|4.1 mil|382|https://scontent.flim1-1.fna.fbcdn.net/v/t1.0-0/cp0/e15/q65/c38.0.1123.629a/s320x320/77350823_2157064911267963_4949943306059513856_o.jpg?_nc_cat=1&efg=eyJpIjoiYiJ9&_nc_ohc=OfCfZbiYuToAQk8B6-chj4T2rxWZY4pwXMZiiqzLNs0IGRC_x3IrAdCRQ&_nc_ht=scontent.flim1-1.fna&oh=35fa0d11997fddaf2f4743e0690b2976&oe=5E85A62C|https://mbasic.facebook.com/events/541044086529330
Pxndx vs My Chemical Romance|Big Brother - Karaoke - Bar|Jr. Huallaga 130 - Cercado de Lima, 13 Lima||||7 de dic., 5:00 || 8 de dic., 23:00|"Último Tributo del año, aprovechando el regreso de My chemical Romance, se viene este versus entre Pxndx y MCR ""Emos X Siempre"" el tributo a Pxndx estará a cargo de Alex Joffre y Punzocortante y el Tributo a MCR a cargo de @grooper Street, , Sin duda será una de esos tributos que traerán mucha nostalgia, feeling total. , , El tributo iniciara temprano, con bandas locales con material propio, para que sea toda una experiencia vivida., , , Sábado 8 7 Diciembre en El Otro Bar Jr. Huallaga 130 - Frente a la Plaza de Armas desde las 5pm , , Pre venta S/10 , Oferta 2x S/15 hasta el 20 de Nov , Puerta S/15 , , WhatsApp 927700852, , Todo por depósito como siempre + Bandas invitadas , "||Tributos Pxndx Perú - Inicio|195|1.1 mil|52|https://scontent.flim1-2.fna.fbcdn.net/v/t1.0-0/cp0/e15/q65/c53.0.1335.748a/s320x320/75398155_2311640755813863_3792163824073703424_o.jpg?_nc_cat=107&efg=eyJpIjoiYiJ9&_nc_ohc=DoNSQoO7v4IAQn5wotCu_01GdPNsTF2dcH1fIow9UTlAaeIZN7BMymaxg&_nc_ht=scontent.flim1-2.fna&oh=4f223ca23b855f4560432d81d4d86d99&oe=5E76EB5F|https://mbasic.facebook.com/events/464148924204316
50 AÑOS de “Let It Be” y “Abbey Road” Un día en la vida|Teatro Peruano Japonés|Av. Gregorio Escobedo 781, Lima||||2019-12-08 17:37:43.121847 - 20:00 ||2019-12-08 17:37:43.121847 - 22:30 |||||||https://scontent.flim1-1.fna.fbcdn.net/v/t1.0-0/cp0/e15/q65/c33.0.974.546a/s320x320/71688935_3597965856896061_5109846145375404032_o.jpg?_nc_cat=103&efg=eyJpIjoiYiJ9&_nc_ohc=DJLsOXwzJbgAQlCIvi_HTch6ODDgTqhXqzpZMC9nos4TuhmyffG65TUdQ&_nc_ht=scontent.flim1-1.fna&oh=1c42fbdf60095a8ace5e36dc3a91f321&oe=5E7EEF67|https://mbasic.facebook.com/events/381261206112264/?event_time_id=381261212778930
Rock Depresivo Antiestético (pre show)|Clandestino|Jr. Pachitea 185, 15001 Lima||||2019-12-08 17:37:46.723396 - 16:00 ||2019-12-08 17:37:46.723396 - 20:00 |||Rock Frogs|186|834|27|https://scontent.flim1-2.fna.fbcdn.net/v/t1.0-0/cp0/e15/q65/c47.0.1405.786a/s320x320/79309416_3088645561164399_3814070231752507392_o.jpg?_nc_cat=102&efg=eyJpIjoiYiJ9&_nc_ohc=q7j9odkaD2EAQk_6YSEKzmRr9U_T3YA2uaNrsRjshvk1DvXUKqEl5bDGA&_nc_ht=scontent.flim1-2.fna&oh=0a8701cfdd7fe1d5892319c15352f2e7&oe=5E79909D|https://mbasic.facebook.com/events/3211971895541095
Para Olvidar Mis Notas|Lima Rock Club|Pasaje Olaya 166, Lima 01 Lima||||2019-12-08 17:37:51.606191 - 16:00 ||2019-12-08 17:37:51.606191 - 23:00 |Estamos armando este evento para, en nuestro caso, cerrar el año y buscar olvidar que no pasaremos de ciclo , para ello tendremos a las siguientes bandas, , , , , , , , , , , , , , , , , , , , , Preventa 1 S/12.00 (Agotado), , Promoción 2 x S/20.00, , Preventa 2 S/17.00, , Puerta S/20.00, , 16:00 PM - 23:00 PM, , , - Pasaje Olaya 166 2do Piso, Lima (a media cuadra de la Plaza de Armas), , Entradas a la venta vía Imbox o en , , , , , También puedes separar entrada haciendo el deposito y enviando el Voucher al WhatsApp +51 931 566 982 en las siguientes cuentas:, * Yape: 931566982, * BCP: 19194907279035, * BBVA: 0011-0814-0201287370, * Interbank: 374-3144465797, A nombre de Edward José Espinoza Valle||El Pogo Del Misio|111|563|22|https://scontent.flim1-2.fna.fbcdn.net/v/t1.0-0/cp0/e15/q65/c0.4.1920.1074a/s320x320/79180855_3106836726009475_4058423784648998912_o.jpg?_nc_cat=109&efg=eyJpIjoiYiJ9&_nc_ohc=BRx7GmSc2EYAQnpY_Zos8_2aawOkQb5RbaROZ_e9EZVXdgrk0pR0ci6ag&_nc_ht=scontent.flim1-2.fna&oh=02c2bacaf8ac8b6529f05a4a87453e01&oe=5E688077|https://mbasic.facebook.com/events/409158433330485
